{
  "$schema": "https://json-schema.org/draft/2020-12/schema",
  "$id": "https://scout.local/schema/target_host_s5a1_execution_policy_v12.json",
  "type": "object",
  "additionalProperties": false,
  "required": ["schema_version", "document_type", "execution_id", "transfer_id", "parent_v11", "package_v8", "v12_contract", "preserved_v11", "tf_contract", "sandbox", "safety"],
  "properties": {
    "schema_version": {"const": "smpcc-r8-liquid-s5a1-execution-policy-v12"},
    "document_type": {"const": "SMPCC_R8_LIQUID_S5A1_EXECUTION_POLICY_V12"},
    "execution_id": {"const": "s5a1_primary_bsmooth_b01_20260811T234000Z_v12"},
    "transfer_id": {"const": "SIM-S1_CORE_H1_C1_Bsmooth_b01_r01_r8_liquid_handoff_v3_v8"},
    "parent_v11": {"$ref": "#/$defs/revision5"},
    "package_v8": {"$ref": "#/$defs/revision4"},
    "v12_contract": {"$ref": "#/$defs/revision4"},
    "preserved_v11": {"$ref": "#/$defs/preservedV11"},
    "tf_contract": {"$ref": "#/$defs/tfContract"},
    "sandbox": {"$ref": "#/$defs/sandbox"},
    "safety": {"$ref": "#/$defs/safety"}
  },
  "$defs": {
    "sha": {"type": "string", "pattern": "^[0-9a-f]{64}$"},
    "path": {"type": "string", "pattern": "^/[^\\u0000]*$"},
    "file": {"type": "object", "additionalProperties": false, "required": ["path", "sha256", "mode", "size_bytes"], "properties": {"path": {"$ref": "#/$defs/path"}, "sha256": {"$ref": "#/$defs/sha"}, "mode": {"type": "string", "pattern": "^[0-7]{4}$"}, "size_bytes": {"type": "integer", "minimum": 0}}},
    "revision4": {"type": "object", "additionalProperties": false, "required": ["policy", "schema", "gate", "tests"], "properties": {"policy": {"$ref": "#/$defs/file"}, "schema": {"$ref": "#/$defs/file"}, "gate": {"$ref": "#/$defs/file"}, "tests": {"$ref": "#/$defs/file"}}},
    "revision5": {"type": "object", "additionalProperties": false, "required": ["policy", "policy_schema", "receipt_schema", "supervisor", "tests"], "properties": {"policy": {"$ref": "#/$defs/file"}, "policy_schema": {"$ref": "#/$defs/file"}, "receipt_schema": {"$ref": "#/$defs/file"}, "supervisor": {"$ref": "#/$defs/file"}, "tests": {"$ref": "#/$defs/file"}}},
    "emptyDir": {"type": "object", "additionalProperties": false, "required": ["path", "inode", "mode", "size_bytes", "nlink", "entry_count", "inventory_sha256"], "properties": {"path": {"const": "/home/zrj/scout_liquid_lab/incoming/SIM-S1_CORE_H1_C1_Bsmooth_b01_r01_r8_liquid_handoff_v3_v7.partial"}, "inode": {"const": 15748876}, "mode": {"const": "0700"}, "size_bytes": {"type": "integer", "minimum": 1}, "nlink": {"const": 2}, "entry_count": {"const": 0}, "inventory_sha256": {"const": "e3b0c44298fc1c149afbf4c8996fb92427ae41e4649b934ca495991b7852b855"}}},
    "unknown": {"const": "UNKNOWN"},
    "preservedV11": {"type": "object", "additionalProperties": false, "required": ["partial_root", "empty_receipt_reservation", "final_root_absent", "final_receipt_absent", "cli_return_code", "worker_error", "publication_error", "primary_bag_post_sha256", "real_bag_read_attempted", "real_bag_read_confirmed", "bwrap_run", "package_entries"], "properties": {"partial_root": {"$ref": "#/$defs/emptyDir"}, "empty_receipt_reservation": {"$ref": "#/$defs/file"}, "final_root_absent": {"const": true}, "final_receipt_absent": {"const": true}, "cli_return_code": {"const": 2}, "worker_error": {"const": "ModuleNotFoundError: No module named 'r8_liquid_s5a1_execution_supervisor_v9'"}, "publication_error": {"const": "Additional properties are not allowed ('parents' was unexpected)"}, "primary_bag_post_sha256": {"const": "c82c1f16b41bced51ab0aff63e4ef40b469501e185851344789fc3d62399fc07"}, "real_bag_read_attempted": {"$ref": "#/$defs/unknown"}, "real_bag_read_confirmed": {"$ref": "#/$defs/unknown"}, "bwrap_run": {"$ref": "#/$defs/unknown"}, "package_entries": {"const": 0}}},
    "diagnostic": {"type": "object", "additionalProperties": false, "required": ["absolute_maximum_position_delta_m", "maximum_time_delta_s", "absolute_maximum_angular_delta_rad", "relative_maximum_translation_delta_m", "relative_rms_translation_delta_m", "relative_maximum_angular_delta_rad"], "properties": {"absolute_maximum_position_delta_m": {"const": 3.9934499955863565}, "maximum_time_delta_s": {"const": 0.005}, "absolute_maximum_angular_delta_rad": {"const": 0.023228249162941604}, "relative_maximum_translation_delta_m": {"const": 0.03995630546880967}, "relative_rms_translation_delta_m": {"const": 0.022725548786785066}, "relative_maximum_angular_delta_rad": {"const": 0.003657518055773045}}},
    "tfContract": {"type": "object", "additionalProperties": false, "required": ["comparison_frame", "maximum_time_delta_s", "maximum_position_delta_m", "maximum_angular_delta_rad", "tf_used_as_motion", "real_diagnostic_witness"], "properties": {"comparison_frame": {"const": "T0_INVERSE_TIMES_T_RELATIVE_SE3"}, "maximum_time_delta_s": {"const": 0.5}, "maximum_position_delta_m": {"const": 0.05}, "maximum_angular_delta_rad": {"const": 0.1}, "tf_used_as_motion": {"const": false}, "real_diagnostic_witness": {"$ref": "#/$defs/diagnostic"}}},
    "environment": {"type": "object", "additionalProperties": false, "required": ["PATH", "HOME", "PYTHONDONTWRITEBYTECODE"], "properties": {"PATH": {"const": "/usr/bin"}, "HOME": {"const": "/nonexistent"}, "PYTHONDONTWRITEBYTECODE": {"const": "1"}}},
    "sandbox": {"type": "object", "additionalProperties": false, "required": ["canonical_argv_sha256", "canonical_token_count", "fd_placeholders", "child_environment", "host_environment", "uid", "gid", "mapped_groups", "writable_bind", "recursive_parent_policies", "generic_nonempty_parent_map_exclusions", "base_receipt_parent_coverage", "local_python_import_closure_count", "local_python_import_closure_sha256", "all_local_imports_ro_bound", "publication_hook_guard", "exact_raw_v1_origin_only"], "properties": {"canonical_argv_sha256": {"$ref": "#/$defs/sha"}, "canonical_token_count": {"type": "integer", "minimum": 1}, "fd_placeholders": {"const": ["@S5A0_RECEIPT_FD@", "@SOURCE_BAG_FD@"]}, "child_environment": {"$ref": "#/$defs/environment"}, "host_environment": {"$ref": "#/$defs/environment"}, "uid": {"const": 1000}, "gid": {"const": 1000}, "mapped_groups": {"const": [65534,65534,65534,65534,65534,65534,65534,65534,1000]}, "writable_bind": {"const": "/home/zrj/scout_liquid_lab/incoming/SIM-S1_CORE_H1_C1_Bsmooth_b01_r01_r8_liquid_handoff_v3_v8.partial"}, "recursive_parent_policies": {"const": ["v11", "v10", "v9"]}, "generic_nonempty_parent_map_exclusions": {"const": ["/home/zrj/scout_liquid_lab/audits/SIM-S1_CORE_H1_C1_Bsmooth_b01_r01_r8_liquid_handoff_v3_v4.execution_v8.json.partial", "/home/zrj/scout_liquid_lab/audits/SIM-S1_CORE_H1_C1_Bsmooth_b01_r01_r8_liquid_handoff_v3_v6.execution_v10.json.partial", "/home/zrj/scout_liquid_lab/audits/SIM-S1_CORE_H1_C1_Bsmooth_b01_r01_r8_liquid_handoff_v3_v7.execution_v11.json.partial"]}, "base_receipt_parent_coverage": {"const": true}, "local_python_import_closure_count": {"type": "integer", "minimum": 1}, "local_python_import_closure_sha256": {"$ref": "#/$defs/sha"}, "all_local_imports_ro_bound": {"const": true}, "publication_hook_guard": {"const": true}, "exact_raw_v1_origin_only": {"const": true}}},
    "safety": {"type": "object", "additionalProperties": false, "required": ["optional_bag_read", "gpu_exposed", "solver_executed", "network_used", "sudo_used", "v8_evidence_preserved", "v10_evidence_preserved", "v11_evidence_preserved", "parent_publisher_used", "real_bag_read_attempted", "real_bag_read_confirmed", "bwrap_run"], "properties": {"optional_bag_read": {"const": false}, "gpu_exposed": {"const": false}, "solver_executed": {"const": false}, "network_used": {"const": false}, "sudo_used": {"const": false}, "v8_evidence_preserved": {"const": true}, "v10_evidence_preserved": {"const": true}, "v11_evidence_preserved": {"const": true}, "parent_publisher_used": {"const": false}, "real_bag_read_attempted": {"$ref": "#/$defs/unknown"}, "real_bag_read_confirmed": {"$ref": "#/$defs/unknown"}, "bwrap_run": {"$ref": "#/$defs/unknown"}}}
  }
}
