{
  "schema_version": "smpcc-r8-liquid-s5a1-execution-policy-v12",
  "document_type": "SMPCC_R8_LIQUID_S5A1_EXECUTION_POLICY_V12",
  "execution_id": "s5a1_primary_bsmooth_b01_20260811T234000Z_v12",
  "transfer_id": "SIM-S1_CORE_H1_C1_Bsmooth_b01_r01_r8_liquid_handoff_v3_v8",
  "parent_v11": {
    "policy": {"path": "/home/zrj/scout_ws/src/scout_apps/simulation/scout_dualsphysics_liquid/config/target_hosts/liquid_zrj_msi_u2404_s5a1_execution_policy_v11.json", "sha256": "e54cd709d579adaa0269abf86fc6afc425cc8d03ab7cb6b33e24bed23baced06", "mode": "0664", "size_bytes": 6809},
    "policy_schema": {"path": "/home/zrj/scout_ws/src/scout_apps/simulation/scout_dualsphysics_liquid/schema/target_host_s5a1_execution_policy_v11.json", "sha256": "4691c362845d27e470d1a41b957e83e8e05ee45cdae027814f2d1de667110e87", "mode": "0664", "size_bytes": 7248},
    "receipt_schema": {"path": "/home/zrj/scout_ws/src/scout_apps/simulation/scout_dualsphysics_liquid/schema/target_host_s5a1_execution_receipt_v11.json", "sha256": "2a3eccfc7c31c1ea6b17b60d643e0ffd1ecc5f694bc6de29f5113aba424f2691", "mode": "0664", "size_bytes": 1712},
    "supervisor": {"path": "/home/zrj/scout_ws/src/scout_apps/simulation/scout_dualsphysics_liquid/scripts/r8_liquid_s5a1_execution_supervisor_v11.py", "sha256": "f7af1f1fdd9cf66b41fe7df82af720e9f8e315f4619a4cf983291f88655d9b52", "mode": "0664", "size_bytes": 27105},
    "tests": {"path": "/home/zrj/scout_ws/src/scout_apps/simulation/scout_dualsphysics_liquid/tests/test_s5a1_execution_supervisor_v11.py", "sha256": "ffae2ed701f0e258bc17b01353e692cd497ecb3816bb43aa1442502a80944605", "mode": "0664", "size_bytes": 5767}
  },
  "package_v8": {
    "policy": {"path": "/home/zrj/scout_ws/src/scout_apps/simulation/scout_dualsphysics_liquid/config/target_hosts/liquid_zrj_msi_u2404_s5a1_primary_handoff_v3_v8.json", "sha256": "033b3261ec7e74ed905ec5e394b11959f07c30d2c85abf890ba292d681611144", "mode": "0664", "size_bytes": 820},
    "schema": {"path": "/home/zrj/scout_ws/src/scout_apps/simulation/scout_dualsphysics_liquid/schema/target_host_s5a1_handoff_package_v8.json", "sha256": "8b455e53c0895d181a01248ce7b79a7188791e501f6692644d933e4d22c2fc15", "mode": "0664", "size_bytes": 483},
    "gate": {"path": "/home/zrj/scout_ws/src/scout_apps/simulation/scout_dualsphysics_liquid/scripts/r8_liquid_s5a1_handoff_gate_v10.py", "sha256": "7549dfc6168ccca3b0956070ccffe6593e95e1e00ea17033fb34e4189d87afa7", "mode": "0664", "size_bytes": 5754},
    "tests": {"path": "/home/zrj/scout_ws/src/scout_apps/simulation/scout_dualsphysics_liquid/tests/test_s5a1_handoff_gate_v10.py", "sha256": "c815d8a5d18cbc425887f5ae7c8ac4504852584fbe75828a355849d4db914b9b", "mode": "0664", "size_bytes": 2380}
  },
  "v12_contract": {
    "policy": {"path": "/home/zrj/scout_ws/src/scout_apps/simulation/scout_dualsphysics_liquid/schema/target_host_s5a1_execution_policy_v12.json", "sha256": "782f105ec44fbe06d95580648d9ba8efda3a0a99f27fe68e01b3318475e50ea8", "mode": "0664", "size_bytes": 8038},
    "schema": {"path": "/home/zrj/scout_ws/src/scout_apps/simulation/scout_dualsphysics_liquid/schema/target_host_s5a1_execution_receipt_v12.json", "sha256": "273e21568a5bf5e813ac76aa463f60bb0a90f05aaf6b8eb533732c01de2a88a4", "mode": "0664", "size_bytes": 1713},
    "gate": {"path": "/home/zrj/scout_ws/src/scout_apps/simulation/scout_dualsphysics_liquid/scripts/r8_liquid_s5a1_execution_supervisor_v12.py", "sha256": "2aedcadaaabdfa5a0ef759b6e5e12e1d97c0011f268acae5a5e5e649637f80ce", "mode": "0664", "size_bytes": 34177},
    "tests": {"path": "/home/zrj/scout_ws/src/scout_apps/simulation/scout_dualsphysics_liquid/tests/test_s5a1_execution_supervisor_v12.py", "sha256": "58731e1e72cc39a1f1f1ece0cf53251b01ebb30a645beb7d4c605a797b923fd3", "mode": "0664", "size_bytes": 10235}
  },
  "preserved_v11": {
    "partial_root": {"path": "/home/zrj/scout_liquid_lab/incoming/SIM-S1_CORE_H1_C1_Bsmooth_b01_r01_r8_liquid_handoff_v3_v7.partial", "inode": 15748876, "mode": "0700", "size_bytes": 4096, "nlink": 2, "entry_count": 0, "inventory_sha256": "e3b0c44298fc1c149afbf4c8996fb92427ae41e4649b934ca495991b7852b855"},
    "empty_receipt_reservation": {"path": "/home/zrj/scout_liquid_lab/audits/SIM-S1_CORE_H1_C1_Bsmooth_b01_r01_r8_liquid_handoff_v3_v7.execution_v11.json.partial", "sha256": "e3b0c44298fc1c149afbf4c8996fb92427ae41e4649b934ca495991b7852b855", "mode": "0440", "size_bytes": 0},
    "final_root_absent": true,
    "final_receipt_absent": true,
    "cli_return_code": 2,
    "worker_error": "ModuleNotFoundError: No module named 'r8_liquid_s5a1_execution_supervisor_v9'",
    "publication_error": "Additional properties are not allowed ('parents' was unexpected)",
    "primary_bag_post_sha256": "c82c1f16b41bced51ab0aff63e4ef40b469501e185851344789fc3d62399fc07",
    "real_bag_read_attempted": "UNKNOWN",
    "real_bag_read_confirmed": "UNKNOWN",
    "bwrap_run": "UNKNOWN",
    "package_entries": 0
  },
  "tf_contract": {
    "comparison_frame": "T0_INVERSE_TIMES_T_RELATIVE_SE3",
    "maximum_time_delta_s": 0.5,
    "maximum_position_delta_m": 0.05,
    "maximum_angular_delta_rad": 0.1,
    "tf_used_as_motion": false,
    "real_diagnostic_witness": {"absolute_maximum_position_delta_m": 3.9934499955863565, "maximum_time_delta_s": 0.005, "absolute_maximum_angular_delta_rad": 0.023228249162941604, "relative_maximum_translation_delta_m": 0.03995630546880967, "relative_rms_translation_delta_m": 0.022725548786785066, "relative_maximum_angular_delta_rad": 0.003657518055773045}
  },
  "sandbox": {
    "canonical_argv_sha256": "c4f0241c24919a35a8a8e34964b00502a12e0802116ab149161d492784ac5ef4",
    "canonical_token_count": 209,
    "fd_placeholders": ["@S5A0_RECEIPT_FD@", "@SOURCE_BAG_FD@"],
    "child_environment": {"PATH": "/usr/bin", "HOME": "/nonexistent", "PYTHONDONTWRITEBYTECODE": "1"},
    "host_environment": {"PATH": "/usr/bin", "HOME": "/nonexistent", "PYTHONDONTWRITEBYTECODE": "1"},
    "uid": 1000,
    "gid": 1000,
    "mapped_groups": [65534,65534,65534,65534,65534,65534,65534,65534,1000],
    "writable_bind": "/home/zrj/scout_liquid_lab/incoming/SIM-S1_CORE_H1_C1_Bsmooth_b01_r01_r8_liquid_handoff_v3_v8.partial",
    "recursive_parent_policies": ["v11", "v10", "v9"],
    "generic_nonempty_parent_map_exclusions": [
      "/home/zrj/scout_liquid_lab/audits/SIM-S1_CORE_H1_C1_Bsmooth_b01_r01_r8_liquid_handoff_v3_v4.execution_v8.json.partial",
      "/home/zrj/scout_liquid_lab/audits/SIM-S1_CORE_H1_C1_Bsmooth_b01_r01_r8_liquid_handoff_v3_v6.execution_v10.json.partial",
      "/home/zrj/scout_liquid_lab/audits/SIM-S1_CORE_H1_C1_Bsmooth_b01_r01_r8_liquid_handoff_v3_v7.execution_v11.json.partial"
    ],
    "base_receipt_parent_coverage": true,
    "local_python_import_closure_count": 28,
    "local_python_import_closure_sha256": "8a1f211dd3341cc6503100e600c6db9f84b01acbed302d8bedaa619a91cfe468",
    "all_local_imports_ro_bound": true,
    "publication_hook_guard": true,
    "exact_raw_v1_origin_only": true
  },
  "safety": {
    "optional_bag_read": false,
    "gpu_exposed": false,
    "solver_executed": false,
    "network_used": false,
    "sudo_used": false,
    "v8_evidence_preserved": true,
    "v10_evidence_preserved": true,
    "v11_evidence_preserved": true,
    "parent_publisher_used": false,
    "real_bag_read_attempted": "UNKNOWN",
    "real_bag_read_confirmed": "UNKNOWN",
    "bwrap_run": "UNKNOWN"
  }
}
